{
  "economic_mandate_id": "econ_20260811_gpu_001",
  "mandate_id": "mandate_gpu_render_001",
  "agent_id": "hermes.creator.router",
  "purpose": "Purchase one bounded GPU render job for an approved CREATOR final render",
  "counterparty_scope": {
    "allowed_merchants": ["approved-gpu-provider-01"],
    "allowed_domains": ["api.approved-provider.example"],
    "allowed_addresses": []
  },
  "value_limit": {
    "amount": "18.00",
    "asset": "USDC"
  },
  "settlement": {
    "mode": "x402",
    "network": "base",
    "asset": "USDC",
    "adapter": "atralth.x402.provider-adapter",
    "credential_class": "capability_handle"
  },
  "constraints": {
    "valid_from": "2026-08-11T00:00:00Z",
    "valid_until": "2026-08-12T00:00:00Z",
    "max_uses": 1,
    "retry_limit": 1,
    "recurring": false,
    "delegation_allowed": false,
    "reversible_required": false,
    "target_must_belong_to_principal": false
  },
  "approval": {
    "required": true,
    "method": "human_passkey",
    "approvers": ["principal:neuro"]
  },
  "risk": {
    "authorization_class": "A2_BOUNDED",
    "contra_required": false,
    "third_party_impact_check": true
  },
  "enforcement": "enforced",
  "created_at": "2026-08-11T00:00:00Z",
  "issued_by": "54-T:policy-decision-point",
  "economic_mandate_hash": "sha256:0000000000000000000000000000000000000000000000000000000000000000"
}
